{"$schema":"https://json-schema.org/draft/2020-12/schema","type":"object","additionalProperties":false,"required":["schema","status","executionAllowed","imageLaunchQualification","semanticQualification","distributionLicenseClosure","runtimeImage","sourceClosure","blockers"],"properties":{"schema":{"const":"shieldkit-labs/p2/gate-b/cohort-node-runtime-materialized/v1/materialization"},"status":{"const":"materialized-static-unqualified"},"executionAllowed":{"const":false},"imageLaunchQualification":{"const":false},"semanticQualification":{"const":false},"distributionLicenseClosure":{"const":false},"runtimeImage":{"const":"runtime-image.v1.json"},"sourceClosure":{"const":"source/node-runtime-closure.v1.json"},"blockers":{"type":"array","minItems":1,"items":{"type":"string"}}}}
