{"blockers":["No execution or semantic qualification is claimed.","glibc distribution notice metadata remains incomplete.","Controller path is intentionally unbound."],"distributionLicenseClosure":false,"executionAllowed":false,"imageLaunchQualification":false,"runtimeImage":"runtime-image.v1.json","schema":"shieldkit-labs/p2/gate-b/cohort-node-runtime-materialized/v1/materialization","semanticQualification":false,"sourceClosure":"source/node-runtime-closure.v1.json","status":"materialized-static-unqualified"}
